{
  "protocol": 1,
  "device_id": "6f1c2a9e-3b7d-4c51-9e2a-0d4b8f7a1c3e",
  "app_version": "1.1 (2026102601)",
  "epoch": 0,
  "changes": [
    {
      "seq": 50,
      "op": "upsert",
      "table": "poker_sessions",
      "id": "A3E1F7C2-5B84-4D6A-9C1E-2F7B0D9E8A41",
      "fields": {
        "status": "completed",
        "end_time": "2026-10-18T05:30:00.000Z",
        "cash_out": 412.5,
        "tilt_level": 2
      }
    },
    {
      "seq": 51,
      "op": "upsert",
      "table": "hands",
      "id": "1c2d3e4f-5a6b-4c7d-8e9f-0a1b2c3d4e5f",
      "fields": {
        "notes": "villain overbet river",
        "did_cbet": null
      }
    },
    {
      "seq": 52,
      "op": "upsert",
      "table": "user_settings",
      "id": "9e8d7c6b-5a49-4382-a716-f5e4d3c2b1a0",
      "fields": {
        "default_game_type": "cash",
        "default_stakes": "2/5",
        "default_buy_in": 500,
        "currency": "USD"
      }
    }
  ],
  "first_sync_done": false
}
