{
  "protocol": 1,
  "device_id": "6f1c2a9e-3b7d-4c51-9e2a-0d4b8f7a1c3e",
  "app_version": "1.1 (2026102601)",
  "epoch": 0,
  "changes": [
    {
      "seq": 1,
      "op": "upsert",
      "table": "poker_sessions",
      "id": "A3E1F7C2-5B84-4D6A-9C1E-2F7B0D9E8A41",
      "fields": {
        "start_time": "2026-10-18T01:00:00.000Z",
        "end_time": null,
        "location": "Synthetic Casino",
        "stakes": "1/2",
        "notes": "",
        "game_type": "cash",
        "status": "active",
        "buy_in": 200,
        "rebuys": 0,
        "add_ons": 0,
        "cash_out": 0,
        "tip_rake": 0,
        "tilt_level": null,
        "energy_level": 4,
        "focus_level": null,
        "table_config": {
          "seats": 9,
          "heroSeat": 3
        },
        "logging_device_id": "6f1c2a9e-3b7d-4c51-9e2a-0d4b8f7a1c3e"
      }
    },
    {
      "seq": 2,
      "op": "upsert",
      "table": "hands",
      "id": "1c2d3e4f-5a6b-4c7d-8e9f-0a1b2c3d4e5f",
      "fields": {
        "session_id": "A3E1F7C2-5B84-4D6A-9C1E-2F7B0D9E8A41",
        "hand_number": 17,
        "played_at": "2026-10-18T02:11:09.250Z",
        "preflop_action": "raise",
        "faced_3bet": false,
        "three_bet_response": null,
        "postflop_result": "wonBeforeShowdown",
        "did_cbet": true,
        "notes": "",
        "position": "BTN"
      }
    }
  ],
  "first_sync_done": false
}
